{"format":"etoki","version":{"major":1,"minor":0},"profile":"core","requires":["sources-v1","audio-v1"],
 "contracts":{"source":1,"runtime":1},"generator":{"name":"motion-academic-slides","version":"0.3.0"},
 "docId":"3f2c9a8e-1b2d-4c5e-9f00-112233445566","entry":"deck.html","sourceSha256":"aaaaaaaaaaaaaaaaaaaaaaaaaaaaaaaaaaaaaaaaaaaaaaaaaaaaaaaaaaaaaaaa",
 "files":{"deck.html":"s0","narration.md":"s1","audio/seg_a.mp3":"a0"},
 "blobs":{"s0":{"mime":"text/html","bytes":10,"sha256":"aaaaaaaaaaaaaaaaaaaaaaaaaaaaaaaaaaaaaaaaaaaaaaaaaaaaaaaaaaaaaaaa","chunks":["etoki-b-s0-0"]},
          "s1":{"mime":"text/markdown","bytes":10,"sha256":"aaaaaaaaaaaaaaaaaaaaaaaaaaaaaaaaaaaaaaaaaaaaaaaaaaaaaaaaaaaaaaaa","chunks":["etoki-b-s1-0"]},
          "a0":{"mime":"audio/mpeg","bytes":10,"sha256":"aaaaaaaaaaaaaaaaaaaaaaaaaaaaaaaaaaaaaaaaaaaaaaaaaaaaaaaaaaaaaaaa","chunks":["etoki-b-a0-0"]}},
 "audio":{"s-k3f9q2:1":{"file":"audio/seg_a.mp3","dur":2.8,"cues":[1.25],"sync":"auto","kind":"tts","inputHash":"aaaaaaaaaaaaaaaaaaaaaaaaaaaaaaaaaaaaaaaaaaaaaaaaaaaaaaaaaaaaaaaa",
   "recipe":{"engine":"irodori-webgpu","model":"500M-v3","voice":{"expert":"bob","novice":"alice"},"seed":42,"dictionary":null,"processing":"trim-45-loud-20-v1"}}},
 "metadata":{"title":"勾配降下法","lang":"ja","license":"CC-BY-4.0","completion":{"visitedFraction":1}}}
